{
  "manifest_version": 3,
  "name": "tabSidian",
  "version": "2.1.2",
  "description": "A browser extension to summarize open tabs into Obsidian markdown files.",
  "icons": {
    "48": "icon48.png",
    "128": "icon128.png"
  },
  "action": {
    "default_icon": "icon48.png",
    "default_title": "tabSidian",
    "default_popup": "popup.html"
  },
  "permissions": ["tabs", "activeTab", "storage", "notifications", "clipboardWrite", "tabGroups"],
  "optional_permissions": [],
  "options_ui": {
    "page": "options.html",
    "open_in_tab": true
  },
  "background": {
    "service_worker": "background.js"
  },
  "web_accessible_resources": [
    {
      "resources": ["share.html", "share.js"],
      "matches": ["<all_urls>"]
    }
  ]
}
